{
  "schemaVersion": 1,
  "projectRoot": "/private/tmp/terraphim-cursor-validation-20261016/public-project",
  "agent": {
    "path": "/private/tmp/published-continue-skills-audit-20261014/clients-1.21.20/extracted/terraphim-agent",
    "sha256": "bff31dc42d6d1a99bf51291039d7719c6a48c2326e582e5e24eaa1eaf11e17ec"
  },
  "roleConfig": {
    "path": "/private/tmp/terraphim-cursor-validation-20261016/public-project/qualification-inputs/warning-fixed-cases/success/role-config.json",
    "sha256": "5370fe22b055dc3d74b3e467e12bf8be5ff9928505edde14be45ecd7f39dcfcd"
  },
  "startupSettings": {
    "directory": "/private/tmp/terraphim-cursor-validation-20261016/public-project/qualification-inputs/warning-fixed-cases/success/settings",
    "settingsSha256": "c13be5bb4630fe67b081ddf127daeaafeab3b85af138786c9425942b9668799c"
  },
  "correctionRole": "cursor-corrections",
  "guardRole": "cursor-guard",
  "compiledRules": {
    "path": "/private/tmp/terraphim-cursor-validation-20261016/public-project/qualification-inputs/warning-fixed-cases/success/compiled-corrections.json",
    "sha256": "95c37b3013f53c38d259b6a4626bb8ef8b4544993d68006781ec8ffca4599b8a"
  },
  "guardRules": {
    "path": "/private/tmp/terraphim-cursor-validation-20261016/public-project/qualification-inputs/warning-fixed-cases/success/guard-rules.json",
    "sha256": "f594d2295f27290d5239f2ac0d78808756994c92b83f550747dfc438220466ef"
  },
  "rewriteEnabled": true,
  "captureFailures": false,
  "evidence": {
    "enabled": true,
    "directory": "/private/tmp/terraphim-cursor-validation-20261016/public-project/qualification-inputs/warning-fixed-cases/success/receipts",
    "outputFiles": [
      "/private/tmp/terraphim-cursor-validation-20261016/public-project/outputs/native-rewrite-warning-fixed.json"
    ]
  }
}
