{
  "schemaVersion": 1,
  "projectRoot": "/private/tmp/terraphim-cursor-validation-20261016/public-project",
  "agent": {
    "path": "/private/tmp/published-continue-skills-audit-20261014/clients-1.21.20/extracted/terraphim-agent",
    "sha256": "bff31dc42d6d1a99bf51291039d7719c6a48c2326e582e5e24eaa1eaf11e17ec"
  },
  "roleConfig": {
    "path": "/private/tmp/terraphim-cursor-validation-20261016/public-project/qualification-inputs/warning-fixed-cases/capture-off/role-config.json",
    "sha256": "ad2dcbe035f0881a8c20b9cda191b79edc36cc69e0e6788129c17a76f2d30689"
  },
  "startupSettings": {
    "directory": "/private/tmp/terraphim-cursor-validation-20261016/public-project/qualification-inputs/warning-fixed-cases/capture-off/settings",
    "settingsSha256": "2dae503aa69973522ef5f9a9e1140e35995533b1276b68a1fa6ed13e7ea516b5"
  },
  "correctionRole": "cursor-corrections",
  "guardRole": "cursor-guard",
  "compiledRules": {
    "path": "/private/tmp/terraphim-cursor-validation-20261016/public-project/qualification-inputs/warning-fixed-cases/capture-off/compiled-corrections.json",
    "sha256": "3812beec693659dc0f7256d6e3166242f6bb56313798c07ba25da2b5e0700e57"
  },
  "guardRules": {
    "path": "/private/tmp/terraphim-cursor-validation-20261016/public-project/qualification-inputs/warning-fixed-cases/capture-off/guard-rules.json",
    "sha256": "f594d2295f27290d5239f2ac0d78808756994c92b83f550747dfc438220466ef"
  },
  "rewriteEnabled": true,
  "captureFailures": false,
  "evidence": {
    "enabled": false
  }
}
